Term,Part of speech,Term Category,Phonetic,Definition,Source,Date first recorded
51% attack,noun,decentralized web,/ˈfɪfti wʌn pərˈsɛnt əˈtæk/,"If more than half the computer power or mining hash rate on a network is run by a single person or a single group of people, then a 51% attack is in operation. This means that this entity has full control of the network and can negatively affect a cryptocurrency by taking over mining operations, stopping or changing transactions, and double-spending coins.",,
account,noun,decentralized web,/əˈkaʊnt/," Accounts are records or statements of financial expenditure and receipts that relate to a particular period or purpose. In the world of crypto, this is referred to as a cryptocurrency account. It gives you certain benefits, and it is a requirement in order to use just about any cryptocurrency exchange. A cryptocurrency account gives you access to hot wallets, which allow you to quickly buy, sell and trade cryptocurrencies, and it gives you an identity or a way through which you can hold onto your public keys when it comes to the aforementioned process.",,
address,noun,decentralized web,"/ˈæd.rɛs/ ""ˈpʌblɪk ˈæd.rɛs""","Synonymous with ""public address"", ""wallet address"". Used to send and receive transactions on a blockchain network, and to identify different users; also referred to as a 'public key'. An address is an alphanumeric character string, which can also be represented as a scannable QR code. In Ethereum, the address begins with 0x. For example: 0x06A85356DCb5b307096726FB86A78c59D38e08ee",,
aggregator,noun,decentralized web,/ˈæɡrɪˌɡeɪtər/,An aggregator is a platform that aggregates liquidity from multiple decentralized exchanges (DEXs) or other sources of liquidity to provide users with the best prices and the most efficient execution for their trades.,,
air-gapping,verb,decentralized web,/ˈɛrˌɡæpɪŋ/,"A method for securing computers in which the device does not connect to the internet or any other open networks. Many hardware wallets use air-gapping as a security mechanism to keep users' private keys or Secret Recovery Phrase offline, and thus safer from any kind of attack.",,
airdrop,noun,decentralized web,/ˈɛrˌdrɑp/,"A token distribution method used to send cryptocurrency or tokens to wallet addresses. Sometimes airdrops are used for marketing purposes in exchange for simple tasks like reshares, referrals, or app downloads.",,
altcoin,noun,decentralized web,/ˈɔltˌkɔɪn/,"As Bitcoin was the first cryptocurrency, the term 'altcoin' was created to refer to 'any cryptocurrency other than Bitcoin'. The term is less used in Ethereum or smart contract-enabled blockchain communities. Many altcoins are forks of Bitcoin with minor changes (e.g., Litecoin). See also 'fork'.",,
appchain,noun,decentralized web,/ˈæpˌtʃeɪn/,"A blockchain network custom-made and optimized for a specific application's needs. An appchain is generally not a full-blown blockchain, but offers an optimized execution environment for the application, while still relying on an underlying blockchain for consensus. See also: 'blockchain trilemma', 'modular blockchain', 'Layer 2', 'Layer 3'.",,
asset provenance,noun,decentralized web,/ˈæsɛt ˈprɑvənəns/,"Asset provenance refers to the origin, history, and ownership of a particular digital asset on the blockchain. In the crypto context, asset provenance refers to the ability to trace the ownership and transfer of a specific cryptocurrency or token from its creation or minting to its current holder.",,
attestation,noun,decentralized web,/ˌætɪˈsteɪʃən/,"Attestation in crypto refers to the process of verifying the authenticity or validity of a piece of information or a transaction on a blockchain network. Attestation is an important aspect of blockchain technology, as it helps to ensure the integrity and security of the network. In general, attestation involves a trusted third-party, or attester, verifying the authenticity of a transaction or piece of information. This can include verifying the identity of users on the network, verifying the accuracy of data, or validating the authenticity of a digital signature. One example of attestation in crypto is the use of digital signatures to authenticate transactions on a blockchain network. Digital signatures use public key cryptography to verify the identity of the sender and ensure that the transaction has not been tampered with. Another example of attestation in crypto is the use of Proof of Stake (PoS) consensus mechanisms, which rely on validators to attest to the validity of transactions on the network. Validators are responsible for verifying transactions and adding new blocks to the blockchain, and they are rewarded with cryptocurrency for their efforts. For more info, see Attestation in Ethereum.",,
base fee,noun,decentralized web,/ˈbeɪs fiː/,Every block has a reserve price known as the 'base fee'. It is the minimum gas fee a user must pay to include a transaction in the next block.,,
block,noun,decentralized web,/blɑk/,"If we think of a blockchain as consisting of a ledger that is being constantly synced between any number of different nodes (indeed, 'distributed ledger technology' is another phrase used to describe it), imagine that after a certain number of transactions have been added to the ledger and consensus has been reached among the nodes that the transactions are valid, then they are cryptographically locked into a 'block' and officially recorded; this 'block' forms the basis for the next one; in this way, they are all linked together in a chain, hence--blockchain.",,
block explorer,noun,decentralized web,/blɑk ɪkˈsplɔrər/,"A blockchain explorer is an application, most often a website along with a corresponding API, that displays information about blockchain activity in a more human-friendly way. While a blockchain is designed to keep information forever, and be “readable by anyone”, finding the specific information you’re interested in may require indexing data off the blockchain–that is, sorting it according to given categories (sender address, token type, etc) into a separate database which can then be queried by the user; this essential function is provided by blockchain explorers. A prominent example is etherscan, which also offers explorers on a number of other networks.",,
block height,noun,decentralized web,/blɑk haɪt/,"The number of blocks connected together in the blockchain. For example, Height 0 would be the very first block, which is also called the Genesis Block.",,
block reward,noun,decentralized web,/blɑk rɪˈwɔrd/,"The reward given to a miner or validator after it has successfully hashed a transaction block. Block rewards can be a mixture of coins and transaction fees. The composition depends on the policy used by the cryptocurrency in question, and whether all of the coins have already been successfully mined. The current block reward for the Bitcoin network is 12.5 bitcoins per block.",,
block time,noun,decentralized web,/blɑk taɪm/,"When we talk about 'block time', we're referring to how long it takes for a block of transactions (see 'block') to be confirmed by the network, either by miners under PoW or by validators under PoS. See also 'Proof of Work', 'Proof of Stake'.",,
blockchain,noun,decentralized web,/ˈblɑkˌtʃeɪn/,"A digital ledger comprised of unchangeable, digitally recorded data in packages called blocks. Each block is ‘chained’ to the next block using a cryptographic signature. Ethereum is a public blockchain, open to the world; its digital ledger is distributed, or synced, between many nodes; these nodes arrive at consensus regarding whether a transaction is valid before encrypting it, along with a number of other valid transactions, into a block. For more on blockchain technology, see here. See also 'block'.",,
blockchain explorer,noun,decentralized web,/ˈblɑkˌtʃeɪn ɪkˈsplɔrər/,"A blockchain explorer is an application, most often a website along with a corresponding API, that displays information about blockchain activity in a more human-friendly way. While a blockchain is designed to keep information forever, and be 'readable by anyone', finding the specific information you're interested in may require indexing data off the blockchain--that is, sorting it according to given categories (sender address, token type, etc) into a separate database which can then be queried by the user; this essential function is provided by blockchain explorers. A prominent example is etherscan, which also offers explorers on a number of other networks.",,
blockchain trilemma,noun,decentralized web,/ˈblɑkˌtʃeɪn traɪˈlɛmə/,"Tradeoffs facing those building public blockchain networks vis-a-vis three elements: decentralization, security, and scalability (or speed). These three elements are either necessary or desireable in public distributed networks, and often, designing a system that optimizes for one compromises on another.",,
brain wallet,noun,decentralized web,/breɪn ˈwɔlɪt/,"A blockchain account generated from a seed phrase or password or passphrase of your choosing. Humans are not capable of generating enough entropy, or randomness, and therefore the wallets derived from these phrases are insecure; brain wallets can be brute forced by super fast computers. For this reason, brain wallet are insecure and should not be used. See also 'Seed phrase / Secret Recovery Phrase'.",,
bridge,noun,decentralized web,/brɪdʒ/,"A bridge is a tool built to move assets from one network to another. It’s also a verb, used to describe that action: “I bridged my ETH from Ethereum mainnet to Arbitrum.” Not all bridges are created equal, and you should be informed about what you’re doing before you use one..  Guide to bridges.  also MetaMask Bridge",,
buidl,noun,decentralized web,/ˈbɪdl/,"Ostensibly coined (see what we did there) by Gitcoin's Kevin Owocki. It reflects the Ethereum-focused mindset of not just investing in a cryptocurrency as a store of value, but rather investing in it as an ecosystem and a platform for public goods and software; it complements, in this sense, the now-infamous HODL.",,
Byzantium fork,noun,decentralized web,/bɪˈzæn.ti.əm fɔːrk/,"A 'hard fork' in the Ethereum network that occurred in October of 2017. For detailled information, see here; see also 'hard fork'.",,
centralized exchange,noun,decentralized web,"/ˌsɛntrəˈlaɪzd ɪkˈstʃeɪndʒ/, /ˈsiːˈɛks/","A centralized exchange (CEX) is a cryptocurrency exchange that is operated and controlled by a centralized entity. In a CEX, the exchange company or organization acts as an intermediary between buyers and sellers, holding and managing the assets on behalf of its users. Centralized exchanges typically offer a wide range of trading pairs, with many popular cryptocurrencies available for trade. They also usually have high liquidity and offer advanced trading features such as margin trading, order types, and charting tools. However, centralized exchanges also have several drawbacks. They are often targeted by hackers, as the centralized nature of the exchange makes them a single point of failure. They also require users to trust the exchange to hold their funds securely and execute trades fairly, which can be a source of concern for some users.",,
CEX,noun,decentralized web,/ˈsiːˈɛks/,Acronym; see 'Centralized Exchange'.,,
chain ID,noun,decentralized web,/tʃeɪn ˈaɪˈdiː/,"A chain ID is a unique identifier that represents a blockchain network. We use it to distinguish different blockchain networks from each other and to ensure that transactions and messages are sent to the correct network. Ethereum networks have two identifiers, a network ID and a chain ID. Although they often have the same value, they have different uses. Peer-to-peer communication between nodes uses the network ID, while the transaction signature process uses the chain ID",,
client,noun,decentralized web,"/ˈklaɪənt/, /ɪˈθiːriəm ɔːr ˈʌðər kəmˈpætəbl ˈblɒkˌtʃeɪn/","In computing in general, a 'client' is a program, running on a local computer, that is accessing data made available by a remote computer. In public blockchain networks, a 'client' is the software that actually does the work of syncing block data, confirming transactions, participating in network consensus, and running any virtual machine or logic processes, if applicable. A client usually includes a cryptocurrency software wallet.",,
coin,noun,decentralized web,/kɔɪn/,"The term 'coin' has some nuances. Strictly speaking, a 'coin' could be defined as: A fungible token (all of them identical) issued on a blockchain, either as the network's transactional token, or through a smart contract deployed to that network. Some people may use 'coins' as shorthand for 'bitcoin'; the immortal aphorism 'not your keys, not your coins' refers to bitcoins. Another thing to keep in mind is that, while coins are put forward as some sort of representation of value, that value can vary wildly from one 'coin' to another. A coin may represent the value of the computational resources of the network, or it may be 'pegged' to represent fiat currency value, or it may float according to the value placed on immaterial resources like NFTs, membership, or digital goods, to name a few.",,
cold storage,noun,decentralized web,/koʊld ˈstɔrɪdʒ/,"cold wallet/cold storage: An offline wallet that is never connected to the internet. These wallets protect cryptocurrencies from getting hacked online. For more information, check out MetaMask's Hardware Wallet Hub: Hardware Wallet Hub",,
cold wallet,noun,decentralized web,/koʊld ˈwɔlɪt/ /koʊld ˈstɔrɪdʒ/,"An offline wallet that is never connected to the internet. These are often referred to as ""airgapped"" or ""cold storage"" wallets; the usage of temperature as a metaphor is to indicate both the ease with which the assets held in accounts by the wallet can be used on a network, as well as an indicator of risk. The idea here is that a ""hot"" wallet, connected to the Internet, is ""ready to use on chain"", and also has a higher risk of being compromised by bad actors. Cold storage wallets, therefore, offer much greater protection for crypto-held assets and tokens.",,
confirmation,noun,decentralized web,/ˌkɒnfərˈmeɪʃən/,"A confirmation happens when a network has verified a blockchain transaction. Under a Proof of Work (PoW) consensus mechanism, this happens through a process known as mining; under Proof of Stake (PoS), the process is known as validation. Once a transaction is successfully confirmed, it theoretically cannot be reversed or double spent. The more confirmations a transaction has, the harder it becomes to perform a double spend attack.",,
consensus,noun,decentralized web,/kənˈsɛnsəs/,"The process used by a group of peers, or nodes, on a blockchain network to agree on the validity of transactions submitted to the network. The consensus layer is responsible for validating and verifying transactions and blocks, and for coordinating communication between nodes to achieve consensus. In a blockchain network, the consensus layer is implemented by the consensus protocol or algorithm that defines how new blocks are added to the chain and how the network reaches agreement on the current state of the ledger. There are various types of consensus mechanisms used in blockchain networks, including proof of work (PoW), proof of stake (PoS), and delegated proof of stake (DPoS). The consensus client implements the specific consensus mechanism used by the network and ensures that all nodes follow the rules and reach agreement on the current state of the blockchain.",,
consensus client,noun,decentralized web,/kənˈsɛnsəs ˈklaɪənt/,"A consensus client is a component of a blockchain node that is responsible for validating and verifying transactions and blocks in the network. It communicates with other nodes to reach consensus on the current state of the blockchain and to ensure that all nodes have a consistent copy of the ledger. See also: ""consensus mechanism"".",,
consensus mechanism,noun,decentralized web,/kənˈsɛnsəs ˈleɪər/,Consensus mechanisms (also known as consensus protocols or consensus algorithms) allow distributed systems (networks of computers) to work together and stay secure.,,
Constantinople fork,noun,decentralized web,/ˌkɒnstænˈtɪnəpl fɔːrk/,"One of the 'hard forks' made to the Ethereum network, in February 2019. For more detailed information, see here; see also 'hard fork'.",,
contract,noun,decentralized web,/ˈkɒntrækt/,See smart contract,,
contract account,noun,decentralized web,/ˈkɒntrækt əˈkaʊnt/,An account containing code that executes whenever it receives a transaction from another account (EOA or contract).,,
crypto asset,noun,decentralized web,/ˈkrɪptoʊ ˈæsɛt/,"A useful blanket term that covers on-chain assets: cryptocurrencies, NFTs, and other, still emerging, products.",,
crypto bounties,noun,decentralized web,/ˈkrɪptoʊ ˈbaʊntiz/,"Crypto bounties are an important rewards mechanism that blockchain projects utilize in order to secure the successful accomplishments of certain tasks required by the network. Initially, bounties were intended as a marketing tool to attract users to participate in performing validation services for blockchain projects. Today, crypto bounties have developed significantly beyond the purpose of a simple marketing tool. crypto bounties ",,
crypto fund,noun,decentralized web,/ˈkrɪptoʊ fʌnd/,A crypto fund is a type of investment fund that focuses on investing in cryptocurrencies or companies involved in the cryptocurrency industry. These funds are designed to give investors exposure to the crypto market without the need for them to directly buy and hold cryptocurrencies themselves.,,
crypto wallet,noun,decentralized web,/ˈkrɪptoʊ ˈwɔlɪt/,"A crypto wallet is a device, physical medium, program or a service which stores the public and/or private keys for cryptocurrency transactions. Crypto wallets come in different forms, including software wallets, hardware wallets, and paper wallets.",,
crypto-,noun,decentralized web,/ˈkrɪptoʊ-/,"Even though this prefix is originally Greek, our current usage comes from cryptography. Technologies that are referred to with the blanket term of 'crypto' tech are underlain by cryptographic tools and processes (such as public/private key pairs) that enable innovative functionality and security. Of course, 'cryptocurrency' often gets shortened to simply 'crypto', so this emerging field is full of instances where something 'crypto' is being added to or shortened. With the emergence of the term 'Web3', arguably a distinction has begun to be made between 'crypto', referring to DeFi and other financial use cases of the technology, while 'Web3' refers to the transition of Internet-based activities to more decentralized practices and platforms.",,
crypto-compliance,noun,decentralized web,/ˈkrɪptoʊ-kəmˈplaɪəns/,A blanket term used to refer to ensuring crypto projects conform with applicable regulations and laws.,,
cryptoassets,noun,decentralized web,/ˈkrɪptoʊˌæsɛts/,"A useful blanket term that covers on-chain assets: cryptocurrencies, NFTs, and other, still emerging, products.",,
cryptocurrency,noun,decentralized web,/ˌkrɪptəˈkɜrənsi/,"Digital currency that is based on mathematics and uses encryption techniques to regulate the creation of units of currency as well as verifying the transfer of funds. Cryptocurrencies operate independently of a central bank, and are kept track of through distributed ledger technology.",,
cryptoeconomics,noun,decentralized web,/ˌkrɪptoʊɪˈkɒnəmɪks/,"The economic analysis of decentralized finance; notably, the MIT Cryptoeconomics Lab.",,
cryptography,noun,decentralized web,/krɪpˈtɒɡrəfi/,"In its broadest sense, cryptography is the art of 'hidden writing' -- using some sort of code to encrypt writing. In modern times, it often refers to the application of this concept within computing, communication, and data transfer through computers and computer networks. Cryptography has been protected as free speech in the United States, and provides the technological foundation that allows blockchain networks to be public: despite the ledger being open and accessible by all, control over the state of the ledger and the ability to move assets on it is mediated through cryptographic tools, such as the Secret Recovery Phrase.",,
DAO,noun,decentralized web,/daʊ/,Acronym; see 'Decentralized Autonomous Organization'.,,
dapp,noun,decentralized web,/dæp/,Acronym; see 'decentralized application',,
decentralization,noun,decentralized web,/ˌdiːsɛntrəlɪˈzeɪʃən/,"The transfer of authority and responsibility from a centralized organization, government, or party to a distributed network.",,
decentralized application,noun,decentralized web,/ˌdiːsɛntrəlaɪzd ˌæplɪˈkeɪʃən/,"An open-source software application with backend (not user-facing) code running on a decentralized peer-to-peer network, rather than a centralized server.  You may see alternate spellings: dApps, DApps, Dapps, and Đapps.",,
Decentralized Autonomous Organization,noun,decentralized web,"/ˌdiːsɛntrəlaɪzd ɔːˈtɒnəməs ˌɔrɡənaɪˈzeɪʃən/, /daʊ/","A Digital Decentralized Autonomous Organization (DAO, pronounced like the Chinese concept) is a powerful and very flexible organizational structure built on a blockchain. Alternatively, the first known example of a DAO is referred to as The DAO. The DAO served as a form of investor-directed venture capital fund, which sought to provide enterprises with new decentralized business models. Ethereum-based, The DAO’s code was open source. The organization set the record for the most crowdfunded project in 2016. Those funds were partially stolen by hackers. The hack caused an Ethereum hard-fork which lead to the creation of Ethereum Classic.",,
decentralized exchange,noun,decentralized web,"/ˌdiːsɛntrəˈlaɪzd ɪkˈstʃeɪndʒ/, /ˈdɛks/","A decentralized exchange (DEX) is a platform for exchanging cryptocurrencies based on functionality programmed on the blockchain (i.e., in smart contracts). If cryptocurrency is web3’s monetary system, its financial system is DeFi. This includes familiar concepts like loans and interest-bearing financial instruments, as well as so-called “DeFi primitives”, novel solutions like token swapping and liquidity pools. The trading is peer-to-peer, or between pools of liquidity. This is in contrast with a centralized exchange, which is more akin to a bank or investment firm that specializes in cryptocurrencies. Additionally, there are so-called on-ramp providers, who could be compared to currency brokers, exchanging traditional “fiat” money for cryptocurrencies, and do not hold customer’s funds “on deposit” the way a centralized exchange does. There are important technical and regulatory differences between these, which are constantly evolving.",,
decentralized web,noun,decentralized web,/ˌdiːsɛntrəˈlaɪzd wɛb/,"The decentralized web, also known as web3, is a concept that refers to a new type of internet architecture that aims to provide a more open, secure, and privacy-preserving internet experience by removing the need for centralized intermediaries and giving users more control over their data. In contrast to the current centralized web, where most online activities are controlled by a few large corporations and their servers, the decentralized web relies on a network of distributed nodes and peer-to-peer protocols to store and transmit data. This means that there is no central authority controlling the internet, and users can interact directly with each other without the need for intermediaries.",,
DeFi,noun,decentralized web,/ˈdiːˌfaɪ/,,,
Delegated proof of stake (DPoS),noun,decentralized web,"/dɪˈlɛɡeɪtɪd pruːf əv steɪk/, /ˌdiːˌpiːˈoʊˈɛs/",,,
denominations,noun,decentralized web,/ˈiːθər/ /ˈdɛnəmɪˌneɪʃənz/,"Cryptocurrencies are, generally speaking, broken into many more, and more granular, denominations than legacy currencies; that is to say, they have defined many decimal points past zero. There are a number of denominations of the currency we know as 'ether' or ETH; for the definitive explanation, see the original Ethereum Homestead documentation Ethereum Homestead documentation here.",,
derive / derivation,noun,decentralized web,"/dɪˈraɪv/, /dɪˈrɪveɪʃən/","To derive something is to obtain it from an original source. In the context of crypto-technology, we often discuss 'deriving' wallets and accounts from seed phrases (aka Secret Recovery Phrases, or SRPs). This is literally true: the SRP represents a cryptographic key which is used to derive account addresses deterministically, meaning they will be derived the same way each time. Another, more technical, way of referring to this technology is to refer to 'hierarchical deterministic' wallets.",,
DEX,noun,decentralized web,/ˈdɛks/,Acronym; see 'decentralized exchange'.,,
difficulty,noun,decentralized web,/ˈdɪfɪkəlti/,"The concept outlining how hard it is to verify blocks in a blockchain network during Proof of Work mining. In the Bitcoin network, the difficulty of mining adjusts every 2016 blocks. This is to keep block verification time at ten minutes.",,
