Term,Part of speech,Term Category,Phonetic,Definition,Source,Date first recorded
difficulty bomb,noun,decentralized web,/ˈdɪfɪkəlti bɒm/,"The difficulty bomb, along with the Beacon Chain and others, was a key element of Ethereum's upgrade to Ethereum 2.0 and a Proof of Stake (PoS) consensus mechanism. As the name indicates, the difficulty bomb was a software mechanism that increased block verification difficulty, making it more expensive and difficult--eventually, prohibitively so--to mine a new block. Through economic incentive, and later, the raw limitations of computing power, this forced the shift to PoS consensus. See also 'Proof of Stake', 'the Merge'.",,
digital identity,noun,decentralized web,/ˈdɪdʒɪtəl aɪˈdɛntɪti/,"An online or networked identity adopted by an individual, organization, or electronic device.",,
digital signature,noun,decentralized web,/ˈdɪdʒɪtəl ˈsɪgnətʃər/,"A short string of data a user produces for a document using a private key such that anyone with the corresponding public key, the signature, and the document can verify that (1) the document was 'signed' by the owner of that particular private key, and (2) the document was not changed after it was signed.",,
distributed ledger,noun,decentralized web,/dɪˈstrɪbjʊtɪd ˈlɛdʒər/,"A type of database which spreads across multiple sites, countries, or institutions. Records are stored sequentially in a continuous ledger. Distributed ledger data can be either “permissioned” or “unpermissioned”, determining who can view it. This term is used, often, to refer in general to public blockchain technology, as 'crypto' has come to mean 'cryptocurrency', 'web3' is the collective community, and 'blockchain', after all, is 'just' the data structure used to sync the distributed ledger itself.",,
Distributed Ledger Technology,noun,decentralized web,/dɪˈstrɪbjʊtɪd ˈlɛdʒər tɛkˈnɒlədʒi/,"A type of database which spreads across multiple sites, countries, or institutions. Records are stored sequentially in a continuous ledger. Distributed ledger data can be either “permissioned” or “unpermissioned”, determining who can view it. This term is used, often, to refer in general to public blockchain technology, as ‘crypto’ has come to mean ‘cryptocurrency’, ‘web3’ is the collective community, and ‘blockchain’, after all, is “just” the data structure used to sync the distributed ledger itself.",,
DLT,noun,decentralized web,/ˈdɪlˌti/,Acronym; see 'distributed ledger technology'.,,
double spend,noun,decentralized web,/ˈdʌbəl spɛnd/,"The 'double spend' is the benchmark security concern of blockchain networks: how do we ensure that someone doesn't send the same transaction to two different entities, essentially 'spending their money twice'? This is the cornerstone of the consensus mechanism, ensuring that all nodes of the network are 'in agreement' about which assets are allocated to which addresses, on an ongoing basis, to prevent malicious actions such as a double spend.",,
ecosystem,noun,decentralized web,/ˈɛkoʊˌsɪstəm/,In the context of 'web3 ecosystem'; 'blockchain ecosystem'. See 'web3'; See 'blockchain',,
EIP,noun,decentralized web,"/ɪˈθiːriəm ɪmˈpruːvmənt prəˈpoʊzəl/, /ˈiːˈaɪˈpiː/","Initialism; Ethereum Improvement Proposals. The EIP process is a public and open process through which suggestions are made as to how to change (and hopefully, improve) the way the Ethereum network functions as a whole; the official repository is here. Individual EIPs are referred to by the name assigned to them in the repository, for example, EIP-1559. Keep in mind that as it is an iterative, lengthy process, some EIPs never get fully approved, and some do, and many end up somewhere in a gray area of 'partially implemented'.",,
EIP-1559,noun,decentralized web,/ˈiːaɪˈpiː ˈfɪftiˌfaɪvˈnaɪn/,"EIP (Ethereum Improvement Proposal) The EIP process is a public and open process through which suggestions are made as to how to change (and hopefully, improve) the way the Ethereum network functions as a whole. Individual EIPs are referred to by the name assigned to them in the repository, for example, EIP-1559. EIP-1559 will change Ethereum’s fee market mechanism. Fundamentally, EIP-1559 gets rid of the first-price auction as the main gas fee calculation. In first-price auctions, people bid a set amount of money to pay for their transaction to be processed, and the highest bidder wins. With EIP-1559, there will be a discrete “base fee” for transactions to be included in the next block. For users or applications that want to prioritize their transaction, they can add a “tip,” which is called a “priority fee” to pay a miner for faster inclusion.",,
encrypted keys,noun,decentralized web,/ɛnˈkrɪptɪd vs ʌnˈɛnkrɪptɪd kiːz/,"As discussed elsewhere, public and private cryptographic key pairs are one of the technologies that underpins cryptocurrencies and 'crypto' tech in general. In MetaMask, an unencrypted private key is 64 characters long, and it is used to unlock or restore wallets. An encrypted key is also 64 letters long and is a regular private key that has gone through the process of encryption. Usually, encrypted private keys are kept within the extension or device they are encrypted by, and they remain out of sight from the user. This is meant to add another layer of security to keep a user’s wallet information safe. By way of example: if the world ‘Apple’ was your private key, then it was encrypted three letters down the alphabet, your new encrypted key would be ‘Dssoh’. Since you know the way to encrypt this key, you could derive the original private key from it by reversing the method of encryption.",,
ENS,noun,decentralized web,"/ɪˈθiːriəm neɪm ˈsɜrvɪs/, /ˈɛns/","Initialism; the Ethereum Name Service is a protocol, managed by a DAO, which assigns human-readable and easy-to-remember addresses to Ethereum addresses and assets, homologous to the traditional internet’s DNS.",,
epoch,noun,decentralized web,/ˈɛpək/,"An epoch, in general, is a measure of time, or of blockchain progression, on a given blockchain. In Ethereum Proof of Stake, an epoch consists of 32 slots, each lasting 12 seconds, for a total of 6.4 minutes per epoch. There is additional functionality built upon the epoch measure in the Beacon Chain to help ensure security and proper operation of the Chain.",,
ERC,noun,decentralized web,/ˈɜrk/,"Ethereum Request for Comment, or ERC, is a bit of a misnomer, as it is used to refer to suggestions for modifications that have already made it through the Ethereum Improvement Protocol (EIP) process and have been made standard on Ethereum. An ERC is, essentially, a set of standards for a given operation or topic on the Ethereum network. The authoritative list can be found here.",,
ERC-1155,noun,decentralized web,/ˈɜrk ˈwʌnˈwʌnˈfaɪvˈfaɪv/,"A token standard for creating semi-fungible tokens, meaning you can launch both fungible and non-fungible tokens within a single smart contract.",,
ERC-20,noun,decentralized web,/ˈɜrk-ˈtwɛnti ˈtoʊkən ˈstændərd/,"ERC is the abbreviation for Ethereum Request for Comment and is followed by the assignment number of the standard. ERC-20 is a technical standard for smart contracts which is used to issue the majority of tokens (in particular, cryptocurrency tokens) extant on Ethereum. This list of rules states the requirements that a token must fulfill to be compliant and function within the Ethereum network.",,
ERC-721,noun,decentralized web,/ˈɜrk-ˈsɛvənˈtwɛnti ˈtoʊkən ˈstændərd/,"ERC-721 Token Standard A standard for Ethereum smart contracts, which allows for the issuance of a non-fungible token: this is the standard that created what we all now know as an NFT. This token standard is used to represent a unique digital asset that is not interchangeable, as opposed to the ERC-20 (or other equivalent) standard, which issues identical, interchangeable tokens.",,
ETH,noun,decentralized web,/ɛθ/,Acronym; see 'ether',,
ether,noun,decentralized web,"/ˈiːθər/, /ˈiːθ/","Ether is the native cryptocurrency of the Ethereum blockchain network. Ether—also referred to as ETH (pronounced with a long “e”, like “teeth” without the “t”)—functions as the fuel of the Ethereum ecosystem, by quantifying the work performed by the network, and as a form of payment for participants securing the network.",,
Ethereum 2.0,noun,decentralized web,/ɪˈθiːriəm tuː pɔɪnt oʊ/,"a.k.a The Merge Finalized in September 2022, the Merge was the culmination of years of work involved in transitioning Ethereum from a Proof of Work consensus model, to Proof of Stake, all while keeping the network live. This was successful, and reduced the network’s carbon footprint by more than 99.9%.",,
Ethereum Virtual Machine,noun,decentralized web,"/ɪˈθiːriəm ˈvɜrʧuəl məˈʃiːn/, /ˈiːˈvɛm/","The EVM is a virtual machine that operates on the Ethereum network. It is Turing complete and allows anyone, anywhere to execute arbitrary EVM bytecode. All Ethereum nodes run on the EVM. It is home for smart contracts based on the Ethereum blockchain.",,
EVM,noun,decentralized web,/ˈiːˈvɛm/,Initialism; see 'Ethereum Virtual Machine'.,,
exchange,noun,decentralized web,/ɪksˈtʃeɪndʒ/,"A place to trade cryptocurrency. Centralized exchanges, operated by companies like Coinbase and Gemini, function as intermediaries, while decentralized exchanges do not have a central authority.",,
execution client,noun,decentralized web,/ɪɡˈzɛkʃən ˈklaɪənt/,"Execution clients are tasked with processing and broadcasting transactions, as well as with managing Ethereum's state. They run the computations for each transaction in the Ethereum Virtual Machine to ensure that the rules of the protocol are followed. Today, they also handle proof of work consensus. After the transition to proof of stake, they will delegate this to consensus clients.",,
execution layer,noun,decentralized web,/ɪɡˈzɛkʃən ˈleɪər/,Ethereum's execution layer is the network of execution clients.,,
Extended Private Key,noun,decentralized web,"/ɪkˈstɛndɪd ˈpraɪvɪt kiː/, /ˈɛksˌpraɪv/","See 'private key' often seen as the acronym 'XPRV'; see 'Hierarchical Deterministic (HD)' wallet. An extended private key, or XPRV, is a private key which can be used to derive child private keys as part of a Hierarchical Deterministic (HD) wallet.",,
Extended Public Key,noun,decentralized web,"/ɪkˈstɛndɪd ˈpʌblɪk kiː/, /ˈɛksˌpʌb/","Often seen as the acronym 'XPUB'. See 'public key'; see 'Hierarchical Deterministic (HD)' wallet. An extended public key, or xpub, is a public key which can be used to derive child public keys as part of a Hierarchical Deterministic (HD) wallet. ",,
faucet,noun,decentralized web,/ˈfɔsɪt/,"A faucet is an application, sometimes a very simple website, other times more complex, that dispenses cryptocurrency. While some networks, especially those in early launch stages, offer “real Mainnet” tokens via faucets, it is much more common for a faucet to be present on a test network, or testnet. These faucets are used by developers to test out dapps or smart contracts before deploying them on Ethereum Mainnet, or users who want to practice an action on the blockchain with no risk. Tokens dispensed by a test faucet stay on the test networks and cannot be exchanged for mainnet equivalents.",,
finality,adjective,decentralized web,"/ˈfaɪnəl/, /faɪˈnælɪti/","A transaction is considered 'final' once it can no longer be changed. In a sense, this happens once there are sufficient confirmations of the transaction, but for all intents and purposes, a transaction is final once the block that contains it is mined or validated. Keep in mind that this reflects a fundamental rule of blockchains: unlike traditional financial systems where charges can be 'reversed', there is no 'undoing' a transaction on the blockchain. Once finality is reached, the transaction is immutable.",,
finality rate,noun,decentralized web,/faɪˈnælɪti reɪt/,See 'finality',,
financial technology,noun,decentralized web,/ˈfaɪnænʃəl tɛkˈnɒlədʒi/,,,
finney,noun,decentralized web,/ˈfɪni/,A denomination of ether. See ether (denomination).,,
fork,noun,decentralized web,/fɔrk/,"Forking' is a term that comes from the world of collaborative software development, and refers to the action of copying an existing application or set of code and modifying it to create an alternate version. At the blockchain protocol level, a 'fork' creates an alternative version of a blockchain. Forks are often enacted intentionally to apply upgrades to a network. Soft Forks render two chains with some compatibility, while Hard Forks create a new version of the chain that must be adopted to continue participation. In the instance of a contentious Hard Fork, this can create two versions of a blockchain network. See also 'hard fork'.",,
fractional ownership,noun,decentralized web,/frækˈʃənl ˈoʊnərˌʃɪp/,"In the context of NFT ownership: A fractional NFT (F-NFT) is an entire NFT broken into smaller fragments, allowing several people to claim ownership of a piece of the same NFT. Fractional NFTs ",,
fraud proof,noun,decentralized web,/frɔd pruːf/,"A security model for certain layer 2 solutions where, to increase speed, transactions are rolled up into batches and submitted to Ethereum in a single transaction. They are assumed valid but can be challenged if fraud is suspected. A fraud proof will then run the transaction to see if fraud took place. This method increases the amount of transactions possible while maintaining security.",,
full node,noun,decentralized web,/fʊl noʊd/,"Public blockchains consist of a network of computers which sync the network's data, coordinate transaction requests, and participate in consensus regarding the validity of those transactions; each one of these computers is called a 'node'. A full node is a computer that can fully validate transactions and download the entire data of a specific blockchain. In contrast, a “lightweight” or “light” node does not download all pieces of a blockchain’s data, and uses a different validation process.",,
gas,noun,decentralized web,/ɡæs/,"A measure of the computational steps required for a transaction on the Ethereum network. This then equates to a fee for network users paid in small units of ETH specified as gwei. For more on gas, see MetaMask’s user guide here: User Guide: Gas",,
gas fee,noun,decentralized web,/ɡæs fiː/,"Gas fee refers to the transaction fee on the blockchain. It is what users pay to get their transaction validated, or completed.",,
gas limit,noun,decentralized web,/ɡæs ˈlɪmɪt/,The gas limit is the maximum amount you’re willing to pay for any given transaction to go through the Ethereum network. Another way of looking at it is as a “rough estimate” of how much computing power your transaction will take.,,
gas price,noun,decentralized web,/ɡæs praɪs/,"The gas price is what it sounds like: the cost the network is paid for the computational work being performed in a given transaction. It is paid in units of ETH called gwei. Depending on network congestion, the gas price may vary significantly.",,
genesis block,noun,decentralized web,/ˈdʒɛnɪsɪs blɒk/,The initial block of data computed in the history of a blockchain network.,,
gigawei,noun,decentralized web,/ˈdʒɪɡəˌweɪ/,"Gwei is a unit of ether, the smallest denomination, which stands for gigawei (or 1,000,000,000). Gwei is used for gas fees, or rather payments made by users to compensate for the computing energy required to process and validate transactions on the Ethereum blockchain.",,
governance,noun,decentralized web,/ˈɡʌvərnəns/,"In the world of cryptocurrencies, governance is defined as the people or organizations that have decision-making powers regarding the project. Governance is an essential aspect of all cryptocurrency projects. As decentralized blockchains, cryptocurrencies often have a very liberal governance structure. There are a number of different approaches to governance. Governance ",,
gwei,noun,decentralized web,/ɡwiː/,"A minuscule and common denomination of ETH, and the unit in which gas prices are often specified. See 'ether (denominations)' entry for more information.",,
gwei,noun,decentralized web,/ɡwiː/,,,
halving,verb,decentralized web,/ˈhælvɪŋ/,"Many cryptocurrencies have a finite supply, which makes them a scarce digital commodity. For example, the total amount of bitcoin that will ever be issued is 21 million. The number of bitcoins generated per block is decreased 50% every four years. This is called “halving.” The final halving will take place in the year 2140.",,
hard fork,noun,decentralized web,/hɑrd fɔrk/,"A hard fork occurs when there is a change in the blockchain that is not backward compatible (not compatible with older versions), thus requiring all participants to upgrade to the new version in order to be able to continue participating on the network. See also 'fork'.",,
hardware wallet,noun,decentralized web,/ˈhɑrdwɛər ˈwɔlɪt/,"A hardware wallet is a physical device that is used to store cryptographic keys, and generally, sign transactions. Some hardware wallets can be connected physically or through software to internet connectivity; others are ‘air-gapped’, receiving transaction requests and sending transaction approvals through a mechanism such as a QR code. The overall goal of using a hardware wallet to manage keys and signatures is to reduce the likelihood of your keys or Secret Recovery Phrase from being somehow stolen or compromised, due to being connected to the Internet. For more on hardware wallets, see MetaMask’s Hardware Wallet Hub: Hardware Wallet Hub",,
hash,noun,decentralized web,/hæʃ/,"In computing, ‘hashing’ is an operation performed on lists or sets of data to create a reliable index for that data. A particular datum, or a reference to it, is fed into an algorithm, which transforms the datum and returns a standardized, and generally unrecognizable, ‘hash’ of it, sometimes referred to as that datum or file’s “digital fingerprint.” Each block in a blockchain contains the hash value that validated the block before it, followed by its own hash value (this is how the continuity of the ‘chain’ is constructed). Hashes can be used to confirm that blockchain transactions are complete and valid. You may see references to the “transaction hash” or “tx hash”; this should be understood as “unique identifier of the transaction”.",,
HD wallet,noun,decentralized web,/ˌhaɪəˈrɑrkɪkəl dɪˈtɜrmɪnɪstɪk ˈwɔlɪt/,"Initialism; Hierarchical Deterministic wallets were first created for Bitcoin, and enable the creation of a very large number of accounts based on an initial seed phrase. This technology was later adopted in Ethereum wallets; when restoring a MetaMask wallet from the Secret Recovery Phrase, for example, if you 'create' accounts, they will be the same accounts as previously created from that same phrase; they are derived from it.",,
hot storage,noun,decentralized web,/hɒt ˈstɔrɪdʒ/,Synonymous with 'hot wallet'.,,
hot wallet,noun,decentralized web,/hɒt ˈwɔlɪt/,"A wallet that is directly connected to the internet at all times; for example, one that is held on a centralized exchange. Hot wallets are considered to have lower security than cold storage systems or hardware wallets.",,
hybrid network,noun,decentralized web,/ˈhaɪbrɪd ˈnɛtwɜrk/,Hybrid blockchain. See 'PoS/PoW Hybrid',,
Hyperledger,noun,decentralized web,/ˈhaɪpərˌlɛdʒər/,"Hyperledger is an ecosystem of open-system tools, libraries, and products designed to enable and support enterprise-grade blockchain technology. In general, the products focus on creating solutions for permissioned blockchains--that is, non-public blockchains, with alternative consensus mechanisms other than Proof of Work (PoW) or Proof of Stake (PoS). That said, there are use cases where such institutions would want to integrate with public blockchains, and for that reason Hyperledger Besu and Hyperledger Burrow are actively developed projects, the former being a Java-based Ethereum client, the latter being a smart contract platform which supports EVM bytecode.",,
ICO,noun,decentralized web,/ˈaɪkoʊ/,"An Initial Coin Offering (also called ICO) occurs when a new token project sells advance tokens in exchange for upfront capital. These have been a vehicle for fraud and scams, and as such are subject to ever-evolving regulation and legislation.",,
ID,noun,decentralized web,/ˈaɪˈdiː/,,,
identicon,noun,decentralized web,/aɪˈdɛntɪkɒn/; /ˈædrɛs aɪˈdɛntɪkɒn/; /ˈædrɛs ˈaɪkɒn/,"The colorful blob of colors that corresponds to your address in MetaMask. It is an easy way to see if your address is correct. More specifically, you can choose between jazzicons (created by the MetaMask team!) or blockies.",,
immutability,noun,decentralized web,/ɪˈmjuːtəbɪlɪti/,"The inability to be altered or changed. This is a key element of blockchain networks: once written onto a blockchain ledger, data cannot be altered. This immutability provides the basis for commerce and trade to take place on blockchain networks.",,
internal transaction,noun,decentralized web,/ˈɪntərnəl ˌtrænˈzækʃən/,"An internal transaction on the Ethereum network is one that occurs between smart contracts, rather than between addresses. Notably, they are not included on the blockchain, and therefore do not incur gas fees, but they are often crucial to carrying out the action in question, and can be viewed on Etherscan. For more detail, see MetaMask's article on the topic: Internal Transactions ",,
interoperability,noun,decentralized web,/ˌɪntərɒpəˈræbɪlɪti/,"Blockchain interoperability, or cross-chain interoperability, is the ability to see and share information across multiple blockchains. One of the clear benefits of blockchain interoperability is being able to trade assets across various blockchains without the need for a centralized, custodial exchange. Interoperability ",,
Kovan,noun,decentralized web,/ˈkoʊvən/,"An Ethereum testnet that uses Proof of Authority consensus, available through MetaMask; Kovan test network has been deprecated. Ethereum used to have four testnets: Ropsten, Rinkeby, Goerli, and Kovan (Kiln was also added for specific purposes relating to the Merge in 2022). However, after the Merge occurred on September 15th 2022, most of the existing testnets began being deprecated (taken out of service). They may still work, but could be unreliable. Sepolia and Goerli are now the only two available.",,
Layer 0,noun,decentralized web,/ˈleɪər ˈzɪroʊ/,"Layer 0 in blockchain refers to the underlying infrastructure that supports the blockchain network. It includes the physical hardware, such as computers, servers, and other network components, as well as the software protocols that govern the interactions between the nodes in the network. In other words, Layer 0 is the foundation upon which the blockchain network is built. It provides the necessary resources and technical capabilities for the network to function, such as computing power, storage, and network connectivity. Layer 0 is essential to the operation and security of the blockchain network, as it ensures that data is transmitted and stored correctly and securely across the network. Layer 0 is sometimes also referred to as 'Layer Zero' or 'L0'. It is important to note that the concept of Layer 0 is not unique to blockchain technology, but is a more general term used to describe the physical and technical infrastructure underlying any type of computer network.",,
Layer 1,noun,decentralized web,/ˈleɪər ˈwʌn/,"Layer 1 in blockchain refers to the base layer of the blockchain protocol. It is the layer that contains the core elements of the blockchain, including the consensus mechanism, the data structure, and the rules that govern the creation and transfer of assets or tokens. In other words, Layer 1 is the foundation of the blockchain technology stack, upon which all other layers and applications are built. It is responsible for maintaining the integrity of the blockchain network and ensuring that all transactions are valid and secure. Layer 1 is designed to be decentralized, meaning that no single entity has control over the network. This is achieved through the use of consensus mechanisms, such as Proof of Work (PoW), Proof of Stake (PoS), or other methods, which enable participants to reach agreement on the validity of transactions and the state of the network. Some examples of Layer 1 blockchain protocols include Bitcoin, Ethereum, Binance Smart Chain, Avalanche.",,
Layer 2,noun,decentralized web,/ˈleɪər ˈtuː/,"A Layer 2 network, or L2, is a blockchain that is built specifically to scale another network. For a full understanding of how this is achieved, see here. Some popular examples of this in the Ethereum ecosystem are Arbitrum, Optimism, and StarkNet. These chains are specifically built to handle a large number of transactions quickly by relying on Ethereum Mainnet for security functions, while optimizing for speed and scale. These networks are considered 'scaling solutions' while not being part of Ethereum's protocol-level scaling efforts. See also 'blockchain trilemma', 'modular blockchain', 'Serenity'. Contrast with 'sidechain'.",,
