Term,Part of speech,Term Category,Phonetic,Definition,Source,Date first recorded
Liquid Democracy (Delegative Democracy),noun,decentralized web,/ˈlɪkwɪd dɪˈmɒkrəsi/ (/ˈdɛlɪɡətɪv dɪˈmɒkrəsi/),"A government system where votes can be delegated or proxied to other individuals such as friends, politicians, or subject matter experts. For example, in a liquid democracy, Bernadette could give Ahmad her vote and Ahmad would then vote for both himself and Bernadette. Liquid democracy is used at times as a governance mechanism for Decentralized Autonomous Organizations (DAOs) wherein every participant is able to vote or delegate their vote to another individual.",,
liquidity pool,noun,decentralized web,/lɪˈkwɪdɪti puːl/,"A liquidity pool is a crowdsourced pool of cryptocurrencies or tokens locked in a smart contract that is used to facilitate trades between the assets on a decentralized exchange (DEX). Instead of traditional markets of buyers and sellers, many decentralized finance (DeFi) platforms use automated market makers (AMMs), which allow digital assets to be traded in an automatic and permissionless manner through the use of liquidity pools.",,
liquidity staking,noun,decentralized web,/lɪˈkwɪdɪti ˈsteɪkɪŋ/,"Liquid staking allows users to stake tokens and simultaneously use them in the DeFi ecosystem. This is made possible by wrapping the staked tokens and providing users with a wrapped token that is a claim on the underlying collateral. The wrapped tokens can be transferred and generate yield. Liquid staking permits users to stake and unstake their coins without being beholden to a lock-up period. It thus enables greater capital efficiency and increased liquidity on proof-of-stake blockchains, allowing users to maximize the benefits of staking and DeFi simultaneously. Furthermore, liquid staking enhances network security on PoS chains.",,
mainnet,noun,decentralized web,/ˈmeɪnˌnɛt/,"The primary network where actual transactions take place on a specific distributed ledger. For example, The Ethereum Mainnet (capitalized in this case) is the public blockchain where network validation and transactions take place",,
maximum priority fee,noun,decentralized web,/ˈmæksɪməm praɪˈɒrɪti fiː/,"The fee, or 'miner tip', goes to the validator or miner, and incentivizes them to prioritize your transaction.",,
mempool,noun,decentralized web,/ˈmɛmpuːl/,"abbreviation; Memory Pool. Also commonly referred to as a 'transaction pool'. When a user submits a transaction to the Ethereum network–or many other networks based on Ethereum–the transaction goes into what’s known as a “transaction pool”, or “txpool” for short. This is essentially a queue of transactions that are waiting to be added to a block and recorded to the blockchain. There are mechanisms that determine which transactions are “picked up” and included in the next block, and there is currently a lot of research surrounding how this decision gets made. In Bitcoin, the transaction pool was referred to as the “memory pool”, or “mempool”, and often these terms are used interchangeably.",,
Merge,noun,decentralized web,/mɜrdʒ/,"Finalized in September 2022, the Merge was the culmination of years of work involved in transitioning Ethereum from a Proof of Work consensus model, to Proof of Stake, all while keeping the network live. This was successful, and reduced the network’s carbon footprint by more than 99.9%.",,
Merkle Patricia trie,noun,decentralized web,/ˈmɜrkl pəˈtrɪʃə traɪ/,"Often referred to simply as a 'Merkle trie' (pronounced 'tree'), a Merkle Patricia trie is a data structure in which a single hash code function (see 'hash') splits into smaller branches. In a similar way to a family tree, where a parent branch splits into child branches, which are then extrapolated into grandchild branches, a Merkle Patricia trie keeps a record of the filiation and history of each element. This type of data structure enables for faster verification on a blockchain network.",,
MEV,noun,decentralized web,"/ˈmæksɪməl ɪkˈstræktəbl ˈvæljuː/, /ˈɛm iː ˈviː/","Acronym; originally known as Miner Extractable Value, MEV is a broad complex topic that refers to the inclusion, exclusion, and reordering of transactions within a block in order to extract more value from it, generally in excess of what a validator (or miner, on PoW networks) would earn from producing the block. MEV includes activities such as frontrunning, arbitrage, and what could be considered malicious actions to profit off of other users' transactions. This is a very active topic of research that is changing rapidly.",,
miner,noun,decentralized web,/ˈmaɪnər/,,,
miner tip,noun,decentralized web,/ˈmaɪnər tɪp/,"The miner tip is the Maximum Priority Fee that incentivizes the miner to prioritize a transaction. Learn the basics of blockchains and Ethereum (miners and validators, gas, cryptocurrencies and NFTs, block explorer, networks, etc.) ",,
mining,noun,decentralized web,/ˈmaɪnɪŋ/,"The process by which blocks or transactions are verified and added to a blockchain using a Proof of Work (PoW) consensus mechanism. In order to verify a block, a miner must use a computer to solve a cryptographic problem. Once the computer has solved the problem, the block is considered “mined” or verified. On Bitcoin or other PoW blockchains, the first computer to mine or verify the block receives bitcoin, or the equivalent network token, as a reward.",,
mint,noun,decentralized web,/mɪnt/,Minting refers to the act of publishing a token on the blockchain to make it transferrable and purchasable.,,
mnemonic phrase,noun,decentralized web,/nɪˈmɒnɪk freɪz/,"This is an alternative way of referring to a Secret Recovery Phrase, also known as a 'seed phrase': a series of words that correspond to a very long cryptographic key, used to generate and control all the addresses of a crypto wallet.",,
modular blockchain,noun,decentralized web,/ˈmɒdjʊlər ˈblɒkˌtʃeɪn/,"Bitcoin is an example of a monolithic blockchain: all of the functions of the network (consensus, execution, data availability, and settlement) are run on one chain. This has significant drawbacks (see 'blockchain trilemma' for more). A modular blockchain, on the other hand, separates some or all of these functions into separate chains, each one optimized for its specific function, and relying on the other chains for the other functions. Ethereum is currently moving towards modularization, both on a protocol level beginning with the Merge, which split consensus and execution into two chains, and at the level of 'Layer 2' networks which provide optimized execution environments, and then 'roll up' their data to Ethereum for its consensus functionality.",,
multi-sig,noun,decentralized web,/ˈmʌltiˌsɪɡ/,"multi-signature wallet (multisig): A crypto-asset wallet which requires multiple keys in order to access and transact. Typically, a specified number of individuals are required to approve or “sign” a transaction before they are able to access the wallet. This is different from most wallets, which only require one signature to approve a transaction.",,
multi-signature wallet (multisig),noun,decentralized web,/ˈmʌltiˈsɪgnətʃər ˈwɔlɪt/ (/ˈmʌltɪsɪɡ/),"A crypto-asset wallet which requires multiple keys in order to access and transact. Typically, a specified number of individuals are required to approve or “sign” a transaction before they are able to access the wallet. This is different from most wallets, which only require one signature to approve a transaction.",,
nested blockchain,noun,decentralized web,/ˈnɛstɪd ˈblɒkˌtʃeɪn/,"A nested blockchain is essentially a blockchain within — or, rather, atop — another blockchain. See 'Layer 2'",,
network,noun,decentralized web,/ˈnɛtwɜrk/,A network refers to all nodes in the operation of a blockchain at any given moment in time.,,
network congestion,noun,decentralized web,/ˈnɛtwɜrk kənˈdʒɛstʃən/,"The reduced quality of service that occurs when a network node or link is carrying more data than it can handle. Typical effects include queueing delay, packet loss or the blocking of new connections. Congestion ",,
NFT,noun,decentralized web,/ɛn ɛf ˈtiː/,"When discussing Non-Fungible Tokens (NFTs), “fungibility” refers to an object’s ability to be exchanged for another. For example, an individual dollar is considered fungible, as one dollar is fully interchangeable with another. Artwork is usually deemed non-fungible, as paintings or sculptures are likely to be unequal between them in quality, value, or other attributes. A non-fungible token is a type of token that is a unique digital asset and has no equal token. This is in contrast to cryptocurrencies like ether that are fungible in nature.",,
NFT aggregator,noun,decentralized web,/ɛn ɛf ˈtiː ˌæɡrɪˈɡeɪtər/,"In the initial wave of interest in buying and selling NFTs, a number of NFT marketplaces--websites where you can buy and sell NFTs--were created. As the market matured, aggregators appeared, which offer the user the ability to view available stock and price, buy and sell across marketplaces from a single unified application. Similar to familiar web2 shopping portals, these have come to be known as NFT Marketplace Aggregators, or just NFT Aggregators.",,
NFT drop,noun,decentralized web,/ɛn ɛf ˈtiː drɒp/,"An NFT drop happens when a new NFT collection is released. NFT drops can vary in both how the NFTs are sold (listed for sale or auction), and in who they’re released to (the public, or a specific list called an “allowlist”).. , NFT drops coincide with when the NFTs in the collection are minted, that is, written to the blockchain. You might hear these terms used interchangeably— a drop might be referred to as the project’s mint.",,
node,noun,decentralized web,/noʊd/,"Public blockchains consist of a network of computers which sync the network's data, coordinate transaction requests, and participate in consensus regarding the validity of those transactions; each one of these computers is called a 'node'. A full node is a computer that can fully validate transactions and download the entire data of a specific blockchain. In contrast, a “lightweight” or “light” node does not download all pieces of a blockchain’s data, and uses a different validation process.",,
non-fungible token,noun,decentralized web,/ˌnɒnˈfʌndʒəbl ˈtoʊkən/,See NFT,,
nonce,noun,decentralized web,/nɒns/,"The word ‘nonce’ has a few different meanings, and in different contexts, it ends up getting used a lot of different ways. Originally formed from a contraction of a phrase meaning “not more than once”, on the Ethereum Mainnet, “nonce” refers to a unique transaction identification number that increases in value with each successive transaction in order to ensure various safety features (such as preventing a double-spend). Note that due to its broader use in cryptography, you may encounter ‘nonce’ being used differently on other sidechains or decentralized projects.",,
off-chain,adjective,decentralized web,/ˌɒfˈtʃeɪn/,"A transaction that is processed outside the blockchain network with an increased speed and reduced cost. There are two different transactions that occur on the blockchain: On-chain transactions are those reflected on the distributed ledger and are visible to all the network users. On the other hand, off-chain transactions occur outside the blockchain network. Such a transaction doesn’t need the services of miners because no ledger verification is conducted. Unlike on-chain transactions, off-chain transactions can be made instantly. This method entails lower fees, happens instantly, and offers more anonymity. ",,
ommer block,noun,decentralized web,/ˈɒmər blɒk/,"Under the Proof of Work (PoW) consensus mechanism, miners received rewards for being the first to mine a new block. However, at times a block would be mined just after, and in competition with, the last block. This block, known as an ommer and previously as an uncle, could get rolled into subsequent blocks and the miner of the original ommer would get a partial block reward. All of this functionality was deprecated as of the launch of the Beacon Chain.",,
on-chain,adjective,decentralized web,/ˌɒnˈtʃeɪn/,"On-chain, as the name implies, refers to blockchain transactions that exist on and have been verified to the blockchain by miners or validators. On-Chain also means that transactions have been recorded to the blockchain",,
on-ramp,noun,decentralized web,"/ˈɒnˌræmp/, /ˈɒfˌræmp/","Based on a metaphor from the American highway system, 'on-ramp' refers to a tool, or a service provider, or the action, of converting fiat currency into tokens on a blockchain. Conversely, 'off-ramp' refers to exchanging on-chain assets for their value in a given fiat currency. There are many providers of such services, and MetaMask users have access to them through the 'Buy Crypto' feature.",,
optimistic rollup,noun,decentralized web,/ɒpˈtɪmɪstɪk ˈrəʊlʌp/,"A rollup that assumes the validity and good faith of transactions, and only runs a fraud proof in the case of fraud being alleged. See also 'rollup'.",,
passphrase,noun,decentralized web,/ˈpæsˌfreɪz/,See 'Secret Recovery Phrase',,
permission,noun,decentralized web,/pərˈmɪʃən/,,,
permissioned ledger,noun,decentralized web,/pərˈmɪʃənd ˈlɛdʒər/,"A blockchain network in which access to ledger or network requires permission from an individual or group of individuals, as opposed to a public blockchain. Permissioned ledgers may have one or many owners. Consensus on a permissioned ledger is conducted by the trusted actors, such as government departments, banks, or other known entities. Permissioned blockchains or ledgers contain highly-verifiable data sets because the consensus process creates a digital signature, which can be seen by all parties. A permissioned ledger is much easier to maintain and considerably faster than a public blockchain. For example, Quorum or Hyperledger Besu are permissioned ledgers that can be more easily set up for large enterprises. In contrast, the public Ethereum blockchain is a permissionless ledger which anyone can access.",,
PKI,noun,decentralized web,/ˈpʌblɪk kiː ˌɪnfrəˈstrʌktʃər/,"Initialism; a public key infrastructure (PKI) is a collection of roles, rules, hardware, software, and processes for creating, managing, distributing, using, storing, and revoking digital certificates. Public-Key Infrastructure ",,
PoA,noun,decentralized web,"/ˈpruːf əv ɔˈθɒrɪti/, /ˌpiː oʊ ˈeɪ/","Initialism; Proof of Authority. A consensus mechanism used in private blockchains, granting a single private key the authority to generate all of the blocks or validate transactions.",,
PoA-PoS-PoW,noun,decentralized web,"/ˌpiː oʊ ˈeɪ/, /ˌpiː oʊ ˈɛs/, /ˌpiː oʊ ˈdʌbəljuː/","Acronyms standing for Proof of X consensus mechanisms: Authority, Stake, Work. The “o” is lowercase since you wouldn’t capitalize “of” when writing out the phrase. See also 'consensus', 'Proof of Authority', 'Proof of Stake', 'Proof of Work'.",,
PoS,noun,decentralized web,"/ˈpruːf əv steɪk/, /ˌpiː oʊ ˈɛs/","Initialism; Proof of Stake. A consensus mechanism in which an individual node, or “validator”, validates transactions or blocks. Validators lock up a certain amount of cryptocurrency, such as ether, into a ‘stake’, in order to be able to participate in consensus. If the node validates a block (group of transactions) correctly, then the validator receives a reward. Conversely, if the validator behaves poorly by validating incorrect transactions or by not maintaining sufficient network connectivity, the cryptocurrency they staked can be ‘slashed’, or taken from them and put out of circulation (‘burned’). PoS requires a negligible amount of computing power compared to Proof of Work consensus.",,
PoS/PoW Hybrid,noun,decentralized web,/ˌpiː oʊ ˈɛs/ /ˌpiː oʊ ˈdʌbəljuː/ ˈhaɪbrɪd/,"A hybrid consensus model that utilizes a combination of Proof of Stake (PoS) and Proof of Work (PoW) consensus. Using this Hybrid consensus mechanism, blocks are validated from not only miners, but also voters (stakeholders) to form a balanced network governance.",,
PoW,noun,decentralized web,"/ˈpruːf əv wɜrk/, /ˌpiː oʊ ˈdʌbəljuː/","Initialism; Proof of Work.A consensus mechanism in which each block is ‘mined’ by one of the nodes, or a group of nodes, on the network. The computational process involved in committing a series of transactions into a block on the network, known as ‘hashing a block’, is technically quite simple, and therefore subject to attack. Under PoW, each miner must solve a math problem to find a set, difficult variable in order to be able to propose their block to the network as the next to be ‘mined’. In effect, the process of hashing each block becomes a competition. This addition of solving for a target increases the difficulty of successfully hashing each block, and consequently the security of the network. For each hashed block, the overall process of hashing will have taken some time and computational effort. Thus, a hashed block is considered Proof of Work, and the miner that successfully hashes the block first receives a reward, in the form of cryptocurrency. PoW is singificantly more energy-intensive than other consensus mechanisms, such as Proof of Stake.",,
priority fee,noun,decentralized web,/ˈpraɪərɪti fiː/,"The priority fee, also referred to as the 'miner tip', incentivizes the miner to prioritize your transaction. Naturally, whether this does actually go to a miner depends on the consensus mechanism they use: Ethereum mainnet became a Proof of Stake network following the Merge in September 2022, so the priority fee goes to validators instead of miners.",,
private blockchain,noun,decentralized web,/ˈpraɪvɪt ˈblɒkˌtʃeɪn/,A blockchain or distributed ledger that has a closed network wherein participants are controlled by a single entity. A private blockchain requires a verification process for new participants. A private blockchain may also limit which individuals are able to participate in consensus of the blockchain network. See also 'permissioned ledger'.,,
private currency,noun,decentralized web,/ˈpraɪvɪt ˈkʌrənsi/,"A currency or token issued by a private individual or firm. Typically, the token or currency is limited to use within the network of that particular firm or individual. This is not to be confused with a “privacy cryptocurrency”, which are cryptocurrencies with specific privacy features, such as hidden user identities.",,
private key,noun,decentralized web,/ˈpraɪvɪt kiː/,"A private key is an alphanumeric string of data that, in MetaMask, corresponds to a single specific account in a wallet. Private keys can be thought of as a password that enables an individual to control a specific crypto account. Never reveal your private key to anyone, as whoever controls the private key controls the account funds. If you lose your private key, then you lose access to, and control over, that account.",,
protocol,noun,decentralized web,/ˈproʊtəkɒl/,"Formally speaking, a 'protocol' is a set of rules governing how a process is carried out. This concept is used throughout public blockchain networks and web3 to refer to the way smart contracts execute their functionality in the same way regardless of the user. The products or services built on top of smart contracts are often referred to as 'protocols' by extension.",,
public address,noun,decentralized web,/ˈpʌblɪk ˈædrɛs/,"An Ethereum public address, also known as an Ethereum account address, is a string of 42 characters (including letters and numbers) that is used to receive or send Ethereum and other Ethereum-based tokens on the Ethereum network. Each Ethereum public address is unique and is associated with a private key that allows the owner of the address to sign and authorize transactions. The public address is derived from the private key using a mathematical algorithm, and it can be shared with others to receive payments or tokens. When sending Ethereum or tokens, users need to specify the recipient's public address as the destination for the transaction. Once the transaction is confirmed by the network, the Ethereum or tokens are transferred to the recipient's address.",,
public blockchain,noun,decentralized web,/ˈpʌblɪk ˈblɒkˌtʃeɪn/,"A globally open network wherein anyone can participate in transactions, participate in the consensus protocol to help determine which blocks get added to the chain, maintain and examine the contents of the chain.",,
public key,noun,decentralized web,/ˈpʌblɪk kiː/,"Public blockchain networks are just that: public. Their data is accessible and readable by anyone. In order to have any degree of usability when it comes to allowing users to do some things, like send transactions, but not others, like steal other peoples’ tokens, cryptographic technology is used. In particular, a design paradigm known as ‘public/private key pairs’ is employed to ensure users can interact with others on the network as they wish, while keeping their own account secure. These key pairs consist of two long strings of alphanumeric characters. A public key can be derived mathematically from its corresponding private key, but the inverse is not true: it is mathematically impossible to derive a private key from its corresponding public key. This allows, for example, users to have a public wallet address that anyone can use to send them tokens, with the peace of mind that as long as they properly keep the corresponding private key safe, those tokens cannot be stolen. See also ‘private key’.",,
public key cryptography,noun,decentralized web,/ˈpʌblɪk kiː ˌkrɪptəˈɡræfi/,"See 'public key',see 'Cryptography', see 'blockchain'. Public-Key Cryptography ",,
relayer,noun,decentralized web,/ˈriːleɪər/,"A relayer is an intermediary that facilitates the exchange or transfer of information, assets, or services between two or more parties. The term is used in various fields, including finance, communication, and technology. In the context of cryptocurrencies and blockchain technology, a relayer typically refers to an intermediary that facilitates peer-to-peer transactions on a decentralized network. This can include decentralized exchanges (DEXs), where relayers act as matching engines to connect buyers and sellers of digital assets. A few examples of popular relayers include 0x: 0x is a decentralized exchange protocol that enables the creation of relayers on the Ethereum blockchain. These relayers can be built by anyone and allow for peer-to-peer trading of ERC-20 tokens. Kyber Network: Kyber Network is a decentralized liquidity network that also operates as a relayer. It enables users to trade a wide range of digital assets, including ERC-20 tokens, without the need for a centralized intermediary. Uniswap: Uniswap is a popular decentralized exchange that operates as a relayer. It uses an automated market maker (AMM) system to enable peer-to-peer trading of ERC-20 tokens. AirSwap: AirSwap is a decentralized exchange that operates as a peer-to-peer relayer on the Ethereum blockchain. It uses an off-chain order book to match buyers and sellers and execute trades.",,
rollups,noun,decentralized web,/ˈrɒlʌps/,"Rollups (pronounced 'roll ups') are one element in the set of tools and infrastructure being built as scaling solutions for the Ethereum network. They consist, in general, of networks which prioritize their ability to compute transactions and smart contract functionality, and then 'roll up' those transactions to Ethereum Mainnet for secure verification of their validity. There are different ways of approaching this problem from a technical point of view, namely Zero Knowledge, or ZK, rollups, and Optimistic rollups. Arbitrum and Optimism are prominent examples. See the entries on both of these types of rollup for more, and more in-depth discussion here.",,
rug pull,verb,decentralized web,/rʌɡ pʊl/,"Similar to the traditional financial scam of a pyramid scheme, a 'rug pull' is a cryptocurrency or crypto-token based scam in which the creators of the token create hype, through injecting liquidity into their token, airdropping, and other schemes, and once investors pile in and boost the price of the token up to a certain point, the creators liquidate their (generally majority) share of the tokens, leaving their investors with next to nothing.",,
Satoshi Nakamoto,person,decentralized web,/ˈsətoʊʃi nəˈkoʊtoʊmi/,"A pseudonymous individual or entity who created the Bitcoin protocol, solving the digital currency issue of the “double spend.” Nakamoto first published their white paper describing the project in 2008, and the first Bitcoin software was released one year later.",,
scalability,noun,decentralized web,/ˈskæləˌbɪlɪti/,"A change in size or scale to handle a network’s demands. This word is used to refer to a blockchain project’s ability to handle network traffic, future growth, and capacity in its intended application.",,
scaling,noun,decentralized web,/ˈskeɪlɪŋ/,"The main goal of scalability is to increase transaction speed (faster finality), and transaction throughput (high transactions per second), without sacrificing decentralization or security.",,
Scrypt,noun,decentralized web,/ˈskrɪpt/,"An alternative proof-of-work (PoW) algorithm to SHA-256, used in Bitcoin mining. Scrypt mining relies more heavily on memory than on pure CPU power, aiming to reduce the advantage that ASICs. Scrypt ",,
