Term,Part of speech,Term Category,Phonetic,Definition,Source,Date first recorded
Consensys,noun,project or product,/kənˈsɛnsɪs/,"Short for Consensus Systems, fka ConsenSys. Launched alongside the founding of the Ethereum network by Joseph Lubin, Consensys was a sort of incubator, seeking to discover, nurture, and develop software, tooling, and use cases for programmable public blockchain networks. Consensys Mesh continues to serve in this broader ""incubator"" role, while Consensys Software Inc. is a for-profit company, maintaining and producing the MetaMask wallet, the Infura and DeFura blockchain data access protocols, the Linea zkEVM Layer 2 network, and the Diligence smart contract auditing service, amongst many other products.",,
Infura,noun,project or product,/ɪnˈfjʊərə/,"Part of Consensys, Infura offers backend access to the Ethereum network over established HTTP and WebSockets technology. Prior to Infura, developers were obligated to run their own nodes of the networks with which they wanted to interact; Infura provides that access through a set of APIs. This enables developers of dapps and websites seeking to interact with the Ethereum blockchain to do so, and at scale. Infura",,
Linea,noun,project or product,/lɪˈniːə/,,,
MetaMask,noun,project or product,/ˈmɛtəˌmæsk/,"MetaMask, either in its mobile app form on iOS and Android, or in its browser extension form, is a tool to access and interact with blockchains and the decentralized web. It allows users to manage their digital identity and the permission of others to interact with that identity; its functions include that of a wallet, a dapp permissions manager, and access to token swaps. It is an open-source project that encourages developers from other projects to build on top of it through MetaMask Snaps.",,
MetaMask Flask,noun,project or product,/ˈmɛtəˌmæsk flæsk/,"MetaMask Flask is a distribution of the software designed for developers. It's like a laboratory (hence the name) where the MetaMask team can try out new ideas and features. It has experimental, even dangerous functionality in it that is not meant for everyday use. It also doesn't have the same stability guarantees that the production distribution of MetaMask has. What is MetaMask Flask, and how is it different from normal MetaMask?",,
MetaMask Institutional,noun,project or product,/ˈmɛtəˌmæsk ˌɪnstɪˈtjuːʃənl/,"MetaMask Institutional is an institution-compliant version of the world’s leading web3 wallet, MetaMask. Organizations trust us to manage their web3 access and engagement with institution-required security, operational efficiency, and compliance. MetaMask Institutional ",,
MetaMask Learn,noun,project or product,/ˈmɛtəˌmæsk lɜrn/,"MetaMask Learn is a free-to-use educational platform available in 10 languages for anyone interested in learning about web3. Through engaging lessons and interactive simulations, it helps you understand what web3 is, why it matters, and how to get started. MetaMask Learn",,
MetaMask Swaps,noun,project or product,/ˈmɛtəˌmæsk swɒps/,"Within MetaMask, users have access to a powerful aggregator showing them information about swaps across the ecosystem, this is MetaMask Swaps. Swaps, when capitalized and referring to this product, should be left in English. ",,
MMI,noun,project or product,"/ˌɪnstɪˈtjuːʃənl/, /ˈmɛtəˌmæsk ˌɪnstɪˈtjuːʃənl/, /ˌɛmˌɛmˈaɪ/",Initialism; MetaMask Institutional.,,
Portfolio,noun,project or product,/ˈpɔrtfoʊlioʊ/,"The Portfolio Dapp enables you to view all your MetaMask accounts and their assets in one place. It aggregates values from across your accounts and shows your total holdings, making it easier than ever to get an at-a-glance summary of their value in your chosen currency. Getting started with MetaMask Portfolio ",,
Quorum,noun,project or product,/ˈkwɔrəm/,"ConsenSys Quorum enables enterprises to leverage Ethereum for their high-value blockchain applications. Businesses can rely on the Quorum open-source protocol layer and integrate on top of it product modules from ConsenSys, other companies, or your own in-house development team to build high-performance, customizable applications. Quorum",,
Snaps (MetaMask Snaps),noun,project or product,"/snæps/, /ˈmɛtəˌmæsk snæps/",A program or piece of code that extends the functionality of MetaMask by using the MetaMask Snaps framework.,,
Teku,noun,project or product,/ˈtiːkuː/,,,
Teku,noun,project or product,/ˈtiːkuː/,,,
0x API,noun,project or product,/ˌzɪroʊ ˈɛks ˈeɪ.pi.aɪ/,"The 0x API is the liquidity and data endpoint for DeFi. It lets you access aggregated liquidity from tens of on-chain and off-chain decentralized exchange networks, across multiple blockchains. It comes with many parameters to customize your requests for your application and your users.",,
1inch,noun,project or product,/ˈwʌn ɪntʃ/,Decentralized exchange aggregator that aims to provide traders with the best price and lowest fees on their transactions.,,
3Box Labs,noun,project or product,/ˈθriː bɑks ˈlæbz/,"The inventors and core developers of Ceramic, the first decentralized network for composable data. Ceramic makes it possible for developers to build data-rich Web3 applications without needing a traditional database, and in the process, unlocks data composability and portability across every application within the Web3 ecosystem",,
Aave,noun,project or product,/ˈɑː.veɪ/,Aave is an open source protocol to create non-custodial liquidity markets to earn interest on supplying and borrowing assets with a variable or stable interest rate.,,
Agoric,noun,project or product,/ˈæɡərɪk/,"Agoric is a Proof-of-Stake blockchain that functions as a smart contract platform, enabling developers to deploy decentralized applications. The platform is built on a variant of the JavaScript programming language, which is a widely used language for web development. ",,
AirGap Vault,noun,project or product,/ˈɛrˌɡæp vɔlt/,"AirGap Vault is a crypto wallet application that provides secure storage for digital assets. The wallet is designed to be used in conjunction with AirGap's other wallet app, AirGap Wallet, which is used for sending and receiving transactions. ",,
AirSwap,noun,project or product,/ˈɛrˌswɑp/,"AirSwap is a decentralized exchange (DEX) platform for trading digital assets, operating on Ethereum and Layer-2s like Polygon, Arbitrum.",,
Apple Pay,noun,project or product,/ˈæpəl ˈpeɪ/,"Apple Pay is a mobile payment service by Apple Inc. that allows users to make payments in person, in iOS apps, and on the web.",,
Arbitrum,noun,project or product,/ˈɑrbɪtrəm/,"Arbitrum is a layer 2 scaling solution for Ethereum, designed to improve the scalability and reduce the cost of transactions on the Ethereum network. It is an implementation of the Optimistic Rollup technology, which is a type of scaling solution that uses off-chain computation to reduce the load on the main Ethereum network.",,
Aurora,noun,project or product,/əˈrɔrə/,,,
Avalanche,noun,project or product,/ˈævəˌlæntʃ/,"Avalanche is a decentralized blockchain platform designed to provide fast and secure transactions for digital assets and applications. The platform uses a consensus mechanism known as Avalanche consensus, which allows for high throughput, low latency, and customizable blockchains.",,
AVAX,noun,project or product,/ˈeɪˈvæks/,,,
Axie Infinity,noun,project or product,/ˈæksi ɪnˈfɪnɪti/,"Axie Infinity is a non-fungible token-based online video game known for its in-game economy, which uses Ethereum-based cryptocurrencies.",,
Banxa,noun,project or product,/ˈbæŋksə/,,,
Beacon Chain,noun,project or product,/ˈbiːkən tʃeɪn/,"The Beacon Chain was one element built in the infrastructure being built to scale Ethereum. It was the foundation for a transition from a Proof of Work (PoW) consensus mechanism to Proof of Stake (PoS). For more information, see this guide.",,
Besu,noun,project or product,/ˈbɛsuː/,,,
Binance,noun,project or product,/ˈbaɪnæns/,"Binance is a centralized cryptocurrency exchange which operates in multiple countries, as well as two different blockchains, the BNB Chain and the BNB Smart Chain.",,
bitcoin,noun,project or product,"/ˈbɪtˌkɔɪn/, /ˈbiːˈtiːˈsiː/","Bitcoin is a decentralized digital currency or cryptocurrency, which was created in 2009 by an unknown person or group using the name Satoshi Nakamoto. Bitcoin transactions are recorded on a public digital ledger called the blockchain, which is maintained by a network of computers worldwide. Bitcoin transactions are made directly between users without the need for intermediaries like banks or financial institutions. Users can send and receive bitcoins using digital wallets. One of the key features of Bitcoin is its limited supply. There will only ever be 21 million Bitcoins in existence, which helps to prevent inflation and maintain the value of the currency. When referring to the overall network, capitalization is appropriate (Bitcoin), whereas when referring to the tokens themselves, lower-case is more appropriate (bitcoin). The plural of bitcoin is just bitcoin; the abbreviation is BTC, with a space: I have 250 BTC.  ",,
Bitcoin,noun,project or product,/ˈbɪtkɔɪn/,,,
BNB,noun,project or product,/ˈbiːɛnˈbiː/,,,
BNB Chain,noun,project or product,/ˈbiːˈɛnˈbiː tʃeɪn/,Build N Build (BNB) Chain is a distributed blockchain network upon which developers and innovators can build decentralized applications (DApps) as part of the move to Web3. BNB chain,,
Brave,noun,project or product,/breɪv/,"Brave is a free and open-source web browser developed by Brave Software, Inc., based on the Chromium web browser. It has a built-in crypto wallet that allows users to connect to the web3 ecosystem. ",,
BTC,noun,project or product,/ˈbiːˈtiːˈsiː/,Abbreviation for Bitcoin,,
BTC (bitcoin),noun,project or product,/ˈbiː tiː ˈsiː/ (/ˈbɪtkɔɪn/),,,
Celo,noun,project or product,/ˈsɛloʊ/,Celo is a platform designed to allow mobile users around the world to make simple financial transactions with cryptocurrency. The platform has its own blockchain and two native tokens: CELO and cUSD,,
Chrome,noun,project or product,/kroʊm/,Internet browser.,,
Codefi,noun,project or product,/ˈkoʊdɪfaɪ/,"Derived from “Commerce & Decentralized Finance”, Codefi was a part of Consensys Software Inc., responsible for developing finance use case blockchain products; name no longer in use.",,
Coinbase Pay,noun,project or product,/ˈkɔɪnbeɪs peɪ/,Coinbase Pay is a payment feature that allows you to buy or transfer supported crypto on Coinbase.com directly from self-custody wallets (like MetaMask) and dapps.,,
CoinGecko,noun,project or product,/ˈkɔɪnˌɡɛkoʊ/,,,
Compound,noun,project or product,/ˈkɑmpaʊnd/,"Compound is a decentralized, blockchain-based protocol that allows you to lend and borrow crypto — and have a say in its governance with its native COMP token.",,
CoolWallet,noun,project or product,/ˈkuːlˌwɔlɪt/,"A crypto hardware wallet for Bitcoin, Ethereum, Litecoin, Bitcoin Cash, and ERC20 Token.",,
CryptoCompare,noun,project or product,/ˈkrɪptoʊˌkɒmpær/,,,
Curve,noun,project or product,/kɜrv/,Curve is a decentralized exchange for stablecoins that uses an automated market maker (AMM) to manage liquidity.,,
D'CENT,noun,project or product,/ˈdiːˈsɛnt/,Hardware wallet.,,
DAI,noun,project or product,/daɪ/,DAI is an Ethereum-based stablecoin whose issuance and development is managed by the Maker Protocol and the MakerDAO decentralized autonomous organization.,,
Devcon,noun,project or product,/ˈdɛvkɒn/,This is shorthand for the Ethereum Developers’ Conference.,,
Diligence,noun,project or product,/ˈdɪlɪdʒəns/,,,
edge,noun,project or product,/ɛdʒ/,"In the context of 'Edge computing': it is an emerging computing paradigm which refers to a range of networks and devices at or near the user. Edge is about processing data closer to where it's being generated, enabling processing at greater speeds and volumes, leading to greater action-led results in real time. The term can also refer to Microsoft's browser or the crypto software wallet",,
EEA,noun,project or product,"/ˈɛntərˌpraɪz ɪˈθiːriəm əˈlaɪəns/, /ˈiːˈiːˈeɪ/","Initialism; Ethereum Enterprise Allliance. A group of Ethereum core developers, startups, and large companies working together to commercialize and use Ethereum for different business applications. Website here.",,
Ethereum,noun,project or product,/ɪˈθiːriəm/,"A public blockchain network and decentralized software platform upon which developers build and run applications. As it is a proper noun, it should always be capitalized.",,
Etherscan,noun,project or product,/ˈɛðərˌskæn/,A popular website for analyzing activity on the Ethereum blockchain. See ‘blockchain explorer’. https://etherscan.io/ ,,
Fantom,noun,project or product,/ˈfæntəm/,"Fantom is a public blockchain platform that aims to facilitate fast and low-cost transactions for dapps and smart contracts. It was launched in 2018 and is based on the Ethereum codebase, but with several key enhancements. One of the main features of Fantom is its consensus mechanism, known as Lachesis, which is a variant of Directed Acyclic Graphs (DAGs) that allows for high transaction throughput and low confirmation times. This means that transactions on the Fantom network can be processed quickly and at a low cost, making it an attractive platform for developers looking to build dApps that require fast and efficient transactions.",,
Firefox,noun,project or product,/ˈfaɪərˌfɒks/,Internet browser.,,
FTM,noun,project or product,/ˈɛfˈtiːɛm/,,,
Gas Station Network,noun,project or product,/ɡæs ˈsteɪʃən ˈnɛtwɜrk/,"The Gas Station Network (GSN) is a decentralized network of relayers mainly referring to the Ethereum blockchain. It allows you to build dapps which provide payment for transactions, so users do not need to hold Ether or ETH to pay for gas, easing their onboarding process and improving user acquisition and experience. However, while the relayers in the GSN do not charge users, they charge the recipient and contract instead. In this way, the relayers recover the costs of transactions and profit from extra fees for providing such services. Originally conceived and designed by TabooKey, the GSN has grown to encompass many companies, protocols and platforms in the Ethereum ecosystem that wish to facilitate the onboarding of users to Ethereum applications. Gas Station Network ",,
Gitcoin,noun,project or product,/ˈɡɪtkɔɪn/,Gitcoin is a platform where coders and developers can get paid to work on open-source software in a wide variety of programming languages. Users can also submit their own project ideas to the Gitcoin platform in order to crowdsource funding from contributing donors. Gitcoin,,
GitHub,noun,project or product,/ˈɡɪthʌb/,"GitHub is an online software development platform. It's used for storing, tracking, and collaborating on software projects. It makes it easy for developers to share code files and collaborate with fellow developers on open-source projects. GitHub also serves as a social networking site where developers can openly network, collaborate, and pitch their work. GitHub ",,
Goerli,noun,project or product,/ˈɡɔrli/,"Goerli is a test networks. It is primarily used for development on the blockchain (testing out applications and smart contracts, etc). ETH on these testnets is a dummy balance and cannot be withdrawn or sent to mainnet.",,
GSN,noun,project or product,/ˈdʒiːˈɛsˈɛn/,Abbreviation for Gas Station Network,,
Harmony,noun,project or product,/ˈhɑːrməni/,,,
IBC,noun,project or product,/ˌɪntərˈblɒkˌtʃeɪn kəˈmjunɪˌkeɪʃən ˈproʊtəkɒl/,"Initialism; Inter-Blockchain Communication (IBC) is a communication protocol that allows different blockchains to relay messages to each other. It guarantees reliable, ordered and authenticated communication between the chains. Blockchains can trustlessly exchange value like tokens. IBC does not work like a bridge. Instead, blockchains send packets of information via smart contracts that allow them to not only exchange value but relay any form of data, such as communication, via the communication protocol.  Inter-Blockchain Communication (IBC) ",,
IPFS,noun,project or product,/ˌaɪˈpiːˈɛfˈɛs/,"Initialism; InterPlanetary File System. A decentralized file storage and referencing system for the Ethereum blockchain, and the internet as a whole. IFPS is an open source protocol that enables storing and sharing hypermedia (text, audio, visual) in a distributed manner without relying on a single point of failure. This distributed file system enables applications to run faster, safer and more transparently.",,
Kovan,noun,project or product,/ˈtɛstˌnɛt ˈkoʊvən/,"An Ethereum testnet that uses Proof of Authority consensus, available through MetaMask; website here.",,
Lattice1,noun,project or product,/ˈlætɪs wʌn/,"The Lattice1 is a powerful, secure, and user-friendly hardware wallet that allows you to manage an unlimited number of wallets and easily transact on the blockchain.",,
Launchpad,noun,project or product,/ˈlɔːntʃˌpæd/,The Launchpad is the Ethereum Foundation's official way to deposit your ETH for staking on Ethereum. Ethereum Launchpad,,
ledger,noun,project or product,/ˈlɛdʒər/,,,
Ledger Live,noun,project or product,/ˈlɛdʒər laɪv/,,,
Ledger Live App,noun,project or product,/ˈlɛdʒər laɪv æp/,"Ledger Live is a hardware wallet interface app for users of the Ledger Nano X, Ledger Nano S, and Ledger Blue. The app enables Ledger users to manage their cryptocurrency hardware and assets. Additionally, it features real-time price updates, multi-account management, and the convenience of an extremely simple setup process. Ledger Live combines the management of your individual crypto assets and device management into one interface, with the intention of gradually replacing the Chrome-based applications system that previously annoyed some users of the device.",,
Lido,noun,project or product,/ˈliːdoʊ/,Lido is a liquid staking protocol for Ethereum that allows users with less than 32 ETH to collectively fund new validators and receive rewards.,,
Lightning Network,noun,project or product,/ˈlaɪtnɪŋ ˈnɛtwɜrk/,"The Lightning Network is a second layer for Bitcoin that uses micropayment channels to scale the blockchain’s capability to conduct transactions more efficiently. This layer consists of multiple payment channels between parties or Bitcoin users. A Lightning Network channel is a transaction mechanism between two parties. Using channels, the parties can make or receive payments from each other. Transactions conducted on the Lightning Network are faster, less costly, and more readily confirmed than those conducted directly on the Bitcoin blockchain.",,
Maker Protocol,noun,project or product,/ˈmeɪkər ˈproʊtəkɒl/,"The Maker Protocol, built on the Ethereum blockchain, enables users to create and hold currency. Current elements of the Maker Protocol are the DAI stable coin, Maker Vaults, and Voting. MakerDAO governs the Maker Protocol by deciding on key parameters (e.g., stability fees, collateral types and rates, etc.)",,
MATIC,noun,project or product,/ˈmætɪk/,,,
Mercuryo,noun,project or product,/mɜrˈkjʊrioʊ/,,,
MobiKwik,noun,project or product,/ˈmoʊbiˌkwɪk/,MobiKwik is an Indian payment service provider founded in 2009 that provides a mobile phone-based payment system and digital wallet.,,
MoonPay,noun,project or product,/ˈmuːnˌpeɪ/,"MoonPay is a financial technology company that builds payments infrastructure for crypto. Its on-and-off-ramp suite of products provides a seamless experience for converting between fiat currencies and cryptocurrencies using all major payment methods, including debit and credit cards, local bank transfers, Apple Pay, Google Pay, and Samsung Pay. MoonPay is active in more than 160 countries and is trusted by 300+ leading wallets, websites, and applications to accept payments and defeat fraud. The company is based in Miami, Florida, and was founded in 2019.",,
Ngrave,noun,project or product,/ˈɛnɡreɪv/,Crypto hardware wallet.,,
ONE,noun,project or product,/wʌn/,,,
OpenSea,noun,project or product,/ˈoʊpənˌsiː/,OpenSea is the world's first and largest web3 marketplace for NFTs and crypto collectibles.,,
Opera,noun,project or product,/ˈɒpərə/,Internet browser.,,
Optimism,noun,project or product,/ɒpˈtɪmɪzəm/,"Optimism is a layer-2 scaling solution for Ethereum, which is a blockchain-based platform for decentralized applications. It is designed to reduce the cost and increase the speed of transactions on the Ethereum network. Optimism works by using a technique called optimistic rollups, which allows it to process a large number of transactions off-chain, while still maintaining the security and decentralization of the Ethereum network. In optimistic rollups, transactions are initially processed off-chain, and a summary of these transactions is then submitted to the Ethereum network for verification. This verification process ensures that the transactions are valid and that no fraud has occurred. Once the transactions are verified, they are added to the Ethereum blockchain, allowing users to interact with the decentralized applications built on the platform.",,
Oracle,noun,project or product,/ˈɔrəkəl/,"Typically, an oracle is any entity or person that is relied on to report the outcome of an event. In a blockchain network an oracle (human or machine) helps communicate data to a smart contract, which can then be used to verify an event or specific outcome.",,
Palm,noun,project or product,/pɑːm/,,,
PALM,noun,project or product,/pɑːm/,,,
ParaSwap,noun,project or product,/ˈpærəswɒp/,"ParaSwap is a decentralized exchange (DEX) aggregator that optimizes swaps for users through better prices, limited gas fees, and lower slippage. ParaSwap sources their liquidity from major DEXes such as Uniswap, Balancer, Curve, Kyber, in addition to ParaSwapPool, their professional Market Maker network.",,
PayPal,noun,project or product,/ˈpeɪˌpæl/,PayPal is a multinational financial technology company operating an online payments system in the majority of countries.,,
Plasma,noun,project or product,/ˈplæzmə/,"Plasma' is a term that is used to refer to one of the solutions being built and deployed in order to securely scale the Ethereum network. A Plasma network functions similarly to an optimistic rollup, inasmuch as it relies on Ethereum Mainnet to maintain the record of transactions, and as the source for arbitration or fraud resolution. However, a Plasma network differs in other important technical ways from rollups, and is currently limited to simple operations, such as swaps and token transfers. More technical information is available here.",,
Polygon,noun,project or product,/ˈpɒlɪɡɒn/,Polygon (formerly Matic Network) is a layer-2 scaling solution for Ethereum that aims to address the scalability issues of the Ethereum blockchain. It is designed to provide faster and cheaper transactions with the same level of security and decentralization as the Ethereum network. Polygon achieves this by creating a multi-chain ecosystem that is built on top of the Ethereum network. This ecosystem consists of various interconnected sidechains that can process transactions independently of the main Ethereum blockchain. These sidechains are called 'Polygon chains' or 'commit chains'.,,
Rarible,noun,project or product,/ˈrɛrəbl/,An NFT marketplace.,,
Rinkeby,noun,project or product,/ˈrɪŋkəbi/,"An Ethereum testnet that uses Proof of Authority consensus, available through MetaMask; Following the transition to Proof of Stake, Rinkeby scheduled its deprecation for the end of 2023.",,
Rocket Pool,noun,project or product,/ˈrɒkɪt puːl/,Rocket Pool is a decentralized Ethereum staking pool.,,
Ropsten,noun,project or product,/ˈtɛstˌnɛt ˈrɒpstən/,"An Ethereum testnet that used Proof of Work, and, following the transition to Proof of Stake, was deprecated.",,
Ropsten,noun,project or product,/ˈrɒpstən/,"An Ethereum testnet that used Proof of Work, and, following the transition to Proof of Stake, was deprecated.",,
Safeheron,noun,project or product,/ˈseɪfˌhɛrən/,Safeheron is an open-source platform for managing digital assets.,,
Samsung Pay,noun,project or product,/ˈsæmsʌŋ peɪ/,Samsung Pay is a mobile payment and digital wallet service that lets users make payments using compatible phones and other Samsung-produced devices.,,
Sardine,noun,project or product,/ˈsɑːdiːn/,Sardine is an instant fiat and crypto settlement platform.,,
Sepolia,noun,project or product,/sɛˈpoʊliə/,"Sepolia is a test networks. It is primarily used for development on the blockchain (testing out applications and smart contracts, etc). ETH on these testnets is a dummy balance and cannot be withdrawn or sent to mainnet",,
Solidity,noun,project or product,/ˈsɒlɪdɪti/,The programming language developers use to write smart contracts on the Ethereum network. See also ‘smart contract’. Solidity,,
Transak,noun,project or product,/ˈtrænsæk/,"Transak is a developer integration toolkit to let users buy/sell crypto in any app, website or web plugin. ",,
Trezor,noun,project or product,/ˈtrɛzər/,Hardware wallet.,,
Uniswap,noun,project or product,/ˈjuːnɪswɒp/,Uniswap is a decentralized cryptocurrency exchange that uses a set of smart contracts to execute trades on its exchange.,,
validium,noun,project or product,/vəˈlɪdiəm/,One of the technologies developed for scaling of the Ethereum network; see more here.,,
